Hive与其他组件有什么关系？	与HDFS间的关系是Apache的Hadoop项目的子项目，Hive利用HDFS作为其文件存储系统。Hive通过解析和计算处理结构化的数据，HadoopHDFS则为Hive提供了高可靠性的底层存储支持。Hive数据库中的所有数据文件都可以存储在HadoopHDFS文件系统上，Hive所有的数据操作也都是通过HadoopHDFS接口进行。与MapReduce间的关系所有的数据计算都依赖于MapReduce。MapReduce也是Apache的Hadoop项目的子项目，它是一个基于HadoopHDFS分布式并行计算框架。Hive进行数据分析时，会将用户提交的HiveQL语句解析成相应的MapReduce任务并提交MapReduce执行。与DBService间的关系的MetaStore元数据服务处理Hive的数据库、表、分区等的结构和属性信息，这些信息需要存放在一个关系型数据库中，由MetaStore维护和处理。在MRS中，这个关系型数据库由DBService组件维护。与Spark间的关系的数据计算也可以运行在Spark上。Spark也是Apache的一个项目，它是基于内存的分布式计算框架。Hive进行数据分析时，会将用户提交的HiveQL语句解析成相应的Spark任务并提交Spark执行。
Windows弹性云服务器无法激活怎么办？	问题描述用户新购买的Windows弹性云服务器一般在1个小时内会自动激活，如果1个小时后仍然没有自动激活，则需要手动处理。
如何解决SR	场景下win7云服务器安装82599网卡驱动报错？问题描述从Intel官网下载最新的20版本驱动包下载地址：，该版本驱动包在Windows764位SR直通弹性云服务器上安装时会提示找不到英特尔适配器错误。
Windows操作系统制作私有镜像为什么要执行Sysprep操作？	对于需要加入域且使用域账号登录Windows操作系统的用户，在创建私有镜像前，需要执行Sysprep操作。否则，镜像会包含和原云服务器相关的信息，特别是SID信息。具有多个相同SID的云服务器加入域会失败。Sysprep的相关详细信息请参考：如果您的windows系统不需要加入域等操作，您可以选择不执行Sysprep操作。由于操作系统的相关限制，只能将Sysprep用于配置Windows操作系统的全新安装。可以根据需要多次运行Sysprep以构建和配置Windows安装。但是，重置Windows激活次数最多为三次。禁止使用Sysprep来重新配置已部署的Windows现有安装。在Windows命令行中输入以下命令，在弹出窗中查看还能执行Sysprep的次数。剩余Windows重置计数的值为0时，无法执行Sysprep。
我如何确定将数据存储在哪个区域？	我如何确定将数据存储在哪个区域？显示一般性问题我如何确定将数据存储在哪个区域？我如何确定将数据存储在哪个区域？根据您的个人需求不同需要考虑多个因素。您可能希望将数据存储在具备以下条件的区域：距离您的客户、数据中心或其他OBS资源较近，以便缩短数据访问延迟。距离运营地点很远，以实现地理位置冗余和灾难恢复。让您能够达到特定法律和法规要求。
为什么缓存实例创建后实际可用内存比申请规格小而且已使用内存不为0？	由于系统开销会占用部分资源，主备实例的持久化也需要一部分资源，所以实例创建后，实际可用内存小于申请规格。除了用户存储数据外，Redis内部的buffer以及内部数据结构会占用一部分内存。所以缓存实例创建后，实例已使用内存量不为0。
按照伸缩策略增加的云服务器，当我不用时可以自动删除吗？	可以，但是需要您增加一条删除云服务器的伸缩策略。
无法导入密钥对，怎么办？	当您的浏览器是IE9时，可能无法导入密钥对或无法使用文件注入功能，请参考如下步骤修改浏览器默认属性后重试。在浏览器主界面，单击选择选项单击选择安全页签。单击如果安全级别显示为自定义，单击默认级别按钮，把设置还原为默认级别。滑动安全级别滑块，把安全级别调到级别，单击应用按钮。选择自定义级别对未标记为可安全执行脚本的ActiveX控件初始化并执行脚本设置为提示单击确定
如何处理VNC方式登录弹性云服务器后，查看数据失败，VNC无法正常使用？	使用VNC方式登录弹性云服务器后，执行查看数据操作时，例如在Linux操作系统下使用cat命令查看大文件、播放视频，由于部分浏览器自身内存占用太大，导致VNC无法正常使用，请更换其他浏览器后重新登录弹性云服务器。
什么是聚合？	聚合是指云监控服务在一定周期内对原始采样指标数据进行最大、最小、平均、求和或方差值的计算，并把结果持久化的过程。这个计算周期又叫聚合周期。聚合是一个平滑的计算过程，聚合周期越长、平滑处理越多，聚合后的数据对趋势的预测和统计越准确；聚合周期越短，聚合后的数据对告警越准确。云监控服务的聚合周期目前最小是5分钟，同时还有20分钟、1小时、4小时、1天，共5种聚合周期。聚合过程中对不同数据类型的处理是有差异的。如果输入的数据类型是整数，系统会对数据进行取整处理。如果输入的数据类型是小数浮点数，系统会保留数据的小数点后两位。例如，弹性伸缩中实例数的数据类型为整数。因此，如果聚合周期是5分钟，采样指标数据分别是1和4，则聚合后的平均值为，而不是2用户可以根据聚合的规律和特点，选择使用云监控服务的方式、以满足自己的业务需求。
弹性云服务器密码设置简单会不会被入侵？	建议您的密码由数字、大小写字母、特殊符号组成，长度在8至26位。同时建议您从华为云的云市场中下载并安装虚拟化杀毒产品和主机安全加固产品，这样可以保证您的弹性云服务器受到更加全面的保护。
磁盘签名文件包含了哪些信息？	磁盘签名文件中包含的内容如下表所示：参数说明数据快递服务服务单号。可通过服务号在数据快递服务页面查询服务单状态。磁盘寄送目的地，即华为数据中心。数据中心详细地址。数据中心联系人。数据中心联系人电话。磁盘回邮详细地址。磁盘联系人。磁盘联系人电话。服务单创建时间。
LOADDATA如何指定HDFS路径?	当数据源导入到HDFS上之后，可以使用LOADDATA命令加载数据，此时路径必须以开头。比如在HDFS上有如下文件：点击放大那么在加载数据时，其HDFS路径为，M命令示例为：
单个主题是否支持通过多种传输协议进行订阅？	单个主题支持多种传输协议定义，目前支持HTTP、邮件、Functionstage以及短信传输协议。
为什么使用密钥文件无法正常登录Linux弹性云服务器？	问题描述用户使用创建弹性云服务器时使用的密钥文件登录Linux云服务器时，登录失败。
文件系统使用空间不足，可以扩容吗？	公测阶段，弹性文件服务不支持扩容功能。
DDS存储的存储配置是什么	存储采用EVS，具体情况请参考云硬盘用户指南的备份数据存储采用OBS，不占用用户购买的数据库空间。关于实例存储的硬件配置，请参见对象存储服务用户指南
操作系统是否有图形界面？	操作系统是桌面管理，Linux操作系统是命令行，用户如果需要可以自己设置图形管理。
私网弹性负载均衡适合什么使用场景？	在一个架构完整的系统中，通常包含多个子系统或者部件。通常各个子系统之间的访问是在内部网络中完成的。例如，业务服务节点对数据库节点的访问和各个子系统或者部件间的接口调用。私网弹性负载均衡可以为这些场景提供流量分发、横向扩展和容错等高可用性的功能。
OBS是否支持批量删除一个桶内的多个对象？	是否支持批量删除一个桶内的多个对象？显示桶和对象是否支持批量删除一个桶内的多个对象？是否支持批量删除一个桶内的多个对象？支持批量删除对象，一次批量删除的对象数最多为100个。OBS管理控制台和OBS客户端均支持批量删除多个对象。
Linux弹性云服务器怎样升级内核？	升级须知对于已安装Tools的Linux弹性云服务器，升级内核前，需先卸载Tools，否则存在如下风险：升级内核后，Linux弹性云服务器无法识别网卡，从而导致网络不通。升级内核后，Linux弹性云服务器无法识别数据盘，从而导致系统启动挂载点异常，弹性云服务器无法正常启动。
部署管理如何收费？	部署服务默认开通，且免费使用。用户部署的应用所使用的资源和部署依赖的服务所使用的资源、ReleaseMan存储、流量等由所使用的服务收费。
如何安装SQLServerManagementStudio	官网提供了SQLServerManagementStudio的安装包。SQLServerManagementStudio应用程序只能在Windows环境运行。操作步骤获取SQLServerManagementStudio的安装包。请访问网站，下载SQLServerManagementStudio。将安装包上传到ECS。双击安装包，按照向导完成安装。
云报表服务支持哪些数据源？	云报表服务目前支持数据源仅为MySQL数据库。
什么是DataPipelineService?	华为云的一项基础服务，可以帮助用户轻松地创建和调度数据管道任务。DataPipelineService集成了多种华为云基础服务，可以帮助用户轻松地使用和移动存放在OBS和RDS中的数据。DataPipelineService也可以帮助用户轻松地创建和调度基于华为弹性大数据服务的数据处理和分析任务。
为什么事件列表中的某些操作被记录了两次？	对于异步调用事件，会产生两条事件记录，其事件名称、资源类型、资源名称等字段相同。在事件列表中，看起来是重复记录了操作例如，Workspace的deleteDesktop事件，但实际上，这两条事件是相互关联、但内容不同的两条记录。第一条事件：记录用户发起的请求；第二条事件：记录用户请求的操作结果，通常与第一条时间记录有数分钟的延迟，记录用户请求的实际响应结果。两条事件需要结合在一起，才能反映用户本次操作的真实结果。
为什么我的数据会丢失或被删除	不会删除和操作用户的任何数据。出现这种情况，请检查是否为误操作，必要时可利用已有备份恢复文件。目前可采取如下方式：使用的恢复功能，详见恢复备份将备份数据从弹性云服务器导入，详见数据迁移
应用程序是否需要支持自动重连数据库	建议您的应用程序支持自动重连数据库，当数据库重启后，无需人工介入，应用会自动恢复，提供更高的可用性。同时建议您的应用程序采用长连接方式连接数据库，以降低资源消耗，提高性能。
如何开通DIS实例？	用户开通实例方式请参见用户指南开通实例章节。
是否能将一个帐户下的弹性云服务器转移到另一个帐户下？	暂时无法提供帐户资源转移的服务。
无法连接数据仓库集群时怎么处理？	检查原因基本原因可能有以下几种：集群状态是否正常。连接命令是否正确，用户名、密码、IP地址或端口无误。安装客户端的操作系统类型、版本是否正确。安装客户端的操作是否正确。如果是在公有云环境无法连接，还需要检查以下可能导致异常的原因：是否与集群在相同可用分区、VPC、子网和安全组。安全组的出入规则是否正确。如果是在互联网环境无法连接，还需要检查以下可能导致异常的原因：用户网络是否与互联网可以正常连通。用户网络防火墙策略是否限制了访问。用户网络是否需要通过代理才能访问互联网。
如何实现读写分离	读写分离指对RDS主实例配置了一个或者多个只读副本后，DDM可以将写操作分发给主实例执行，将读操作分发给只读副本执行。读写分离极大地提高了数据库的并发性能。读写分离特性一般由DDM内部实现，用户无需在应用代码上做设置。的读写分离模式为：默认事务内的SQL都会走主实例，非事务内的SQL会根据DDM内置的策略选择只读副本执行。也支持用户在SQL中自定义读写分离策略，只需要在SQL前加上指定标签：标签表示事务内走只读副本，事务外的SQL会走主实例，SQL举例如下：标签表示忽略事务状态，强制走主实例，SQL举例如下：标签表示忽略事务状态，强制走只读副本，SQL举例如下：
用户公有云账户欠费给云审计服务带来的影响？	当用户公有云账户欠费时，云审计服务依旧可以接收所支持服务发送的操作信息，但只能保存近7天的操作记录。因为7天之前的历史操作记录会以事件文件的形式实时保存至OBS桶，而将事件文件存储于OBS桶所产生的流量需要付费。此外，云审计服务的追踪器状态会显示为欠费，可以进行配置删除操作，但配置时无法重新选择
外部服务器能否访问DDS	外部服务器暂不能访问，您只能通过ECS来访问它。
集群节点显示不可用？	现象描述集群节点显示不可用，通过linux用户登录node节点执行命令发现docker进程故障，查看docker日志，日志路径为，出现如下类似日志：
消息通知服务的主题名称有何格式要求？	主题名称必须由大写和小写字母，数字，下划线连字符组成，长度在1到256个字符之间，必须由大写、小写字母或数字开头。
云专线接入前期要考虑的要素有哪些？	要考虑的因素有：云专线带宽速率，云专线条数，以及云专线接入的端口类型等因素。云专线带宽速率以运营商提供的速率规格为准。专线条数根据实际情况参考只需要一条还是两条做高可靠性冗余。端口类型分为光口还是电口。
如何获取磁盘加密工具TrueCrypt？	磁盘加密工具TrueCrypt可从华为云开发者中心下载获取，网址为：工具有适用于Windows和Linux操作系统的不同版本，请按实际需求下载使用。
是否支持余额不足提醒？	用户可在充值页面自助设置余额阈值，系统会在用户购买支付时进行余额扣费检查，小于等于阈值则发送提醒。
为何使用了RDS后网站登录较慢	推荐您做如下两个处理：通过RDS管理控制台查看RDS的性能情况。与应用程序有很大关系，使用命令查看当前数据库连接状态，比较本地数据库和RDS的差异。
怎样执行手动扫描检测？	登录管理控制台，选择安全合作伙伴产品中心主机入侵检测，进入主机列表页面。找到需要执行扫描的弹性云服务器，单击手动扫描对于扫描状态扫描完成的弹性云服务器，选择更多扫描详情可查看报告。
ELB支持什么类型的会话保持？	针对7层协议服务，ELB系统是基于cookie的会话保持。针对4层协议服务，ELB系统是基于IP地址的会话保持。
弹性伸缩一定要搭配弹性负载均衡、云监控才能使用吗？	弹性伸缩服务可以单独使用，也可以同弹性负载均衡云监控一起使用。其中，CES服务为免费服务，系统默认开通；ELB服务在有需求时可以部署，例如，有分布式集群需求的场景下，可以使用ELB。
安全指数服务分多少个安全等级？	安全指数服务分为三个等级：安全、低风险、高风险。
怎样启用主机入侵检测？	三步即可启用服务：下载客户端到本地，上传客户端到弹性云服务器。登录弹性云服务器，安装客户端。环境：请使用用户安装客户端，安装成功后客户端自动运行。环境：请使用用户安装客户端，安装成功后客户端自动运行。登录管理控制台，选择安全合作伙伴产品中心主机入侵检测，单击开启检测
为什么入不了会？	入会失败有很多原因，包括网络原因和服务器等，具体错误码在收到CONF消息时会返回，具体参考接口文档。华为公有云环境主要有以下原因、没有调用初始化开发者信息：用户需要调用tup接口初始化开发者的帐号和私钥信息。、帐号不存在：开发者的帐号为华为公有云的帐号，而不是邮箱或手机号码。、帐号和私钥不匹配：开发者的私钥不对，开发者的私钥需要和上传到公有云上的公钥配对。
审核未通过的域名还可以再修改吗？	不可以。如果域名审核未通过，那表明该域名未通过工信部备案。此类域名不允许接入CDN。不过对于正在备案中未审核通过的域名，华为云后台将会定期扫描，如果审核通过后，CDN状态将自动切换到已开启状态。
如何使用Scrum流程项目管理？	项目管理的开发流程分为精简流程项目流程项目，以下介绍Scrum流程项目的操作流程。流程项目管理以层级关系提供了多种类型的工作项，从大到小依次为类型，用户在项目中根据实际需要新建不同类型的工作项，指定责任人、优先级、工作量以及跟踪工作项状态和进度管理等。
不同地域价格是否一样？	目前在国内，不同地域的价格是相同的，但不排除以后地域之间会有价格差异。
占用RDS磁盘空间的日志及文件有哪些	占用RDS磁盘空间的日志及文件如下表：数据库引擎文件类型日志文件：数据库undo、redo和Binlog文件。数据文件：数据库内容文件和索引文件。其他文件：ibdata、ib和临时文件等。日志文件：数据库错误日志文件和事务日志文件。数据文件：数据库内容文件、索引文件、复制槽数据文件、事务状态数据文件和数据库配置文件。其他文件：临时文件。日志文件：数据库的错误日志、事务日志文件和跟踪文件。数据文件：数据库内容文件。
支持Cloudinit特性后，对使用弹性伸缩服务有哪些影响？	是开源的云初始化程序，能够对新创建弹性云服务器中指定的自定义信息主机名、密钥和用户数据等进行初始化配置。在创建伸缩配置时，通过Cloud进行对云服务器的初始化配置。弹性伸缩组使用的伸缩配置中的私有镜像若没有安装Cloud工具，伸缩活动创建的弹性云服务器会出现如下情况：如使用未安装Cloudbase的Windows私有镜像创建的弹性云服务器，在获取弹性云服务器密码时，系统将提示查询不到密码。您只能通过镜像本身的密码登录此云服务器。若忘记镜像本身密码，可以通过云服务器页面重置密码功能，自助完成云服务器的密码重置。如使用未安装Cloud的Linux私有镜像创建的云服务器，使用创建时输入的密码或秘钥将无法正常登录云服务器。您只能通过镜像本身的密码或秘钥登录此云服务器。若忘记镜像本身密码，或镜像本身的秘钥丢失，可以通过云服务器页面重置密码功能，自助完成云服务器的密码重置。如使用未安装Cloud的私有镜像创建云服务器时，用户数据注入会失败。鉴于出现上述情况，在使用弹性伸缩服务时，请检查伸缩配置中的私有镜像是否已经安装并配置了Cloud或者Cloudbase工具，请将使用了未安装Cloud的私有镜像的伸缩配置删除，并使用已安装Cloud的私有镜像创建新的伸缩配置。具体操作步骤：登录管理控制台。选择计算弹性伸缩服务选择伸缩配置页签，进入伸缩配置列表页面。单击创建伸缩配置，选择已安装Cloud或Cloudbase工具的私有镜像创建新的伸缩配置。在伸缩组中将伸缩配置修改为新创建的伸缩配置。
节点状态与应用状态不一致？	当节点的实际状态发生变化时，CCE界面上的节点状态可能不会立即更新延迟大概2分钟，而该节点上的应用状态能够实时更新，所以会出现节点状态与应用状态不一致的现象。
裸金属服务器操作系统自带FTP上传吗？	裸金属服务器操作系统没有自带，FTP需要用户自行安装和配置。
是否可删除已发布的消息？	已发布的消息不能删除。
收到磁盘已挂载的短信后，我要如何启动数据上传？	当您收到磁盘已挂载的短信后，请尽快登录DESConsole，单击待上传AK服务单后的上传AK，根据界面提示，将后台往OBS的桶中上传数据时需要使用的密钥对信息和磁盘解密密码填写到弹出的对话框中。若您没有AK，请通过我的认证页面创建。若没有对磁盘数据加密，可不用填写磁盘解密密码。
不同帐号下弹性云服务器内网是否可以互通？	不同帐号下的弹性云服务器内网是不通的。
无法成功创建数据仓库集群时怎么处理？	检查原因检查是否用户已经没有配额创建新的数据仓库集群。
弹性文件服务用于哪些使用场景？	弹性文件服务可通过文件系统增强工作负载和性能，使用场景包括媒体处理、日志管理、内容管理和主目录和高性能计算等。
云硬盘支持扩容吗	云硬盘支持扩容，数据盘和系统盘均支持扩容。只有云硬盘处于可用状态，即云硬盘没有挂载到云服务器时才可以扩容云硬盘。处于正在使用状态的云硬盘无法进行扩容。
管理员如何参与云服务的试用体验	华为云帐号无法直接登录即时通信客户端，在创建企业时，创建的管理员帐号可以登录客户端。点击放大
为什么DDL命令在Beeling中执行失败？	当Beeling被启动，默认的用户为匿名用户。该用户将不具有权限去写或删除HDFS的内容。因此DDL命令在Beeling中执行失败。解决方法：当启动Beeling窗口时，输入带有参数的用户名。例如：
操作系统是否需要收费？	公有云平台提供的Linux系统和Windows系统不需要您支付版权费用。
使用DES服务后在什么情况下会给我发短信通知？	当服务单申请成功、磁盘挂载成功、数据传输成功和订单关闭时，DES会给您发送短信，让您掌握DES服务单关键进展。
使用云服务器创建私有镜像，需要多长时间？	使用云服务器创建私有镜像，通常需要约20分钟。
使用FunctionStage是否需要开通计算、存储、网络等服务？	用户使用FunctionStage时，不需要开通或者预配置计算、存储、网络等服务，由FunctionStage提供和管理底层计算资源，包括服务器CPU、内存、网络和其他配置资源维护、代码部署、弹性伸缩、负载均衡、安全升级、资源运行情况监控等，用户只需要按照FunctionStage支持的编程语言提供代码，上传即可运行。
华为云帮助中心	如果用户通过外部镜像文件注册私有镜像失败，且在任务中心查看错误信息为外部镜像文件的系统盘容量大于用户设置的系统磁盘容量。此问题通常有两种情况：用户设置的系统盘大小小于原来平台虚拟机的系统盘大小，请重新确认原镜像文件的系统盘大小并重新注册。用户使用的vhd格式是通过qemu或者其他类似工具转换生成，产生的vhd格式的实际虚拟磁盘大小和用户原虚拟机系统盘大小不一致，具体原因参考：此情况下可以通过qemu工具的qemu命令检查处理。计算virtualsize的bytes换算成以G为单位的值是否为整数值。如上所示，2147991552bytes通过换算得到大小约为2大于2G，因此上传时，上传时需要设置系统盘大小大于2G的值。
UQuery支持对接哪些数据源	支持对接以下数据源：
DES服务单有哪些状态？	服务单具有如下几种状态：待寄送磁盘待上传AK正在传输待回寄磁盘传输失败已完成已取消已过期几种状态的转换关系如下图所示：点击放大
弹性云服务器无法启动或连接怎么办？	如果弹性云服务器无法启动或连接，可拨打免费客服电话4000
软件开发云中如何注册华为云用户？	初次使用软件开发云时，需先注册用户；注册成功后，可以登录软件开发云中开始使用服务。说明：软件开发云中项目管理配置管理代码检查编译构建测试管理移动应用测试部署管理发布管理流水线各大服务为同一个注册用户。
如何保存工作表？	为了避免数据丢失，云报表服务会自动保存工作表内容，用户无需手动保存。
云审计服务是否支持事件文件的关键字验证？	支持。原则上进行关键字验证时必须包含以下字段：time、service、resource、trace、trace、trace，其他字段由各服务自己定义。
为什么产品的剩余配额不为零，但是创建产品实例时仍然提示配额不足？	产品的剩余配额是管理员为最终用户分配的该产品可创建的产品实例数，但它受可创建产品实例的总数的限制默认额度为200。当企业内所有用户已创建产品实例的总数超过额度限制时，无法再创建新的产品实例。
