部署管理各角色类型对应的操作权限是什么？	部署管理中用户的角色类型及对应的操作权限说明，如表1所示。表1角色类型及操作权限角色操作授信机器挂靠主机组授信机器未挂靠主机组主机组部署模板部署任务通知项目创建者全部权限：添加、修改、删除、查看授信机器创建、查看授信机器修改、删除自己的授信机器
操作系统自带FTP上传吗？	需要用户自己安装和配置。
什么是私网弹性负载均衡	私网弹性负载均衡是支持同一个虚拟私有云下的云服务器之间互相访问的负载均衡功能。同一个虚拟私有云下的云服务器通过访问私网弹性负载均衡的服务IP和端口来将负载分发到后端云服务器上。
一个帐号最多可以创建多少个私有镜像？	在当前阶段，您在一个区域内默认最多可以创建10个私有镜像。如果您需要创建更多的私有镜像，可以通过提交工单的方式，申请扩大配额上限。
M	多维交互分析服务，简称M，是一种新型的ApacheHadoop本地文件格式。通过采用列式存储、索引、压缩和编码技术，提高计算效率，实现PB数量级的数据交互查询。M也是一种将数据源和Spark集成的高性能分析引擎。
弹性云服务器在什么时候进入开通状态？	包年包月的弹性云服务器：当您支付完费用且系统扣款成功后，将自动为您开通弹性云服务器。按需的弹性云服务器：由于是先使用后付费，所以确认创建后就进入开通状态。
我的数据通过DES传输，如何保证安全性？	支持使用第三方加密工具Truecrypt对数据进行加密，邮寄加密后的数据可确保数据在寄送途中的安全。华为数据中心管理员在接收到磁盘并挂载后，需要由用户自己输入AK和加密密钥触发数据自动上传，华为人员全程不接触和密钥和用户数据，确保数据的安全。通过DES传输的数据最终存放在对象存储服务OBS中，OBS服务支持SSL加密、ACL权限控制、桶策略等安全保障机制，且数据分片随机存储在不同硬盘上，保障数据的存储、访问安全。
RDS有哪些安全保障措施	网络可以设置所属VPC，从而确保RDS实例与其他业务实现网络安全隔离。使用安全组确保访问源为可信的。使用SSL通道，确保数据传输加密。数据库实例数据库配置了防暴力破解功能。
云服务器备份服务支持对弹性云服务器中所有云硬盘进行备份吗？	支持。云服务器备份服务可以通过创建备份策略并绑定云服务器，将云服务器中的所有云硬盘作为整体进行备份和恢复，不支持对云服务器中的部分云硬盘进行备份和恢复。
如何使用联络中心服务？	您需要有座席客户端才能使用联络中心的服务。座席客户端有两种获取方式：获取座席Demo，该Demo不能正式商用，仅用于测试和体验。基于华为接口开发座席客户端。图1使用联络中心服务点击放大
邮寄磁盘的费用由谁来承担？	您需要将磁盘邮寄至华为数据中心由DES帮您完成数据传输，该邮寄费用需要您来承担。当数据传输完成后，华为数据中心将会采取邮费到付的方式将磁盘回邮给您，该邮费也需要由您来承担。
机器学习服务可以做什么？	机器学习服务应用于海量数据挖掘分析场景。市场分析商场从顾客消费记录中找出某类顾客群的共有特征兴趣、收入水平和消费习惯等，分析出什么样的顾客买什么产品，从而调整市场策略。定向推荐银行从客户的个人财务状况信息中分析客户特征，定向推荐合适的产品贷款项目、理财产品，以小代价获取大收益。欺骗检测保险公司分析投保人的历史行为数据，建立欺骗行为模型，识别出假造事故骗取保险赔偿的投保人。
什么是CloudStream？	实时流计算服务，简称Stream，是运行在华为云上的实时流式大数据分析服务，全托管的方式用户无需感知集群的存在，只需聚焦于StreamSQL，即时执行作业，完全兼容Flink。为用户打造了一个易使用、高安全、高可靠的运行维护平台，是华为公司在IT领域主推的低时延级时延、高吞吐、高可靠的分布式实时流计算服务。它以Flink为核心，孵化一些Flink上的特性，是一个批处理和流处理结合的分布式计算框架，提供了数据分发以及并行化计算的流数据处理能力，适用于实时性要求高、吞吐大的业务场景。
攻击和弱点列表记录哪些信息，可以删除吗？	攻击列表记录：攻击ID，攻击时间，攻击源，攻击类型，事件详情，攻击者ID，攻击目标。最多记录最近一周内的事件，不可删除。弱点列表记录：弱点ID，告警时间，弱点类型，告警详情，目标实例。最多记录最近一周内的弱点，不可删除。
跨域资源共享	显示跨域资源共享跨域资源共享
编译构建各角色类型对应的操作权限是什么？	编译构建中用户的角色类型及对应的操作权限说明，如表1所示。表1角色类型及操作权限角色操作编译构建任务通知项目创建者创建、修改、删除、执行、禁用、搜索、查看编译构建任务下载编译构建包查看任务执行报告历史获取构建任务的代码仓库地址
登录会议管理控制台，提示该区域不支持所选服务怎么办？	会议管理控制台，提示该区域不支持所选服务怎么办？华为云会议目前仅针对中国华北区1开通服务。如您登录会议管理控制台，提示该区域不支持所选服务，可能是在此之前您手动切换过默认区域。直接在提示页面单击中国华北区1，切换默认区域为中国华北区1，如图1所示。图1切换默认区域
计费	问：对于创建节点失败期间回滚的资源，我是否需要付费？是。无论节点是否创建成功，创建节点期间使用的云服务器资源均需收费，该过程会根据公有云服务器的统一收费策略来收取费用。
为什么创建弹性云服务器的任务失败，但是在云服务器列表中显示创建成功？	问题描述在弹性IP资源不足的情况下，用户通过管理控制台创建一台绑定弹性IP的弹性云服务器，此时弹性云服务器创建成功，但是绑定弹性IP失败。这种情况下，弹性云服务器申请状态栏显示任务失败，但弹性云服务器列表页面显示云服务器创建成功。
MSTSC方式登录Windows2012的弹性云服务器，登录失败怎么办？	问题描述对于密码鉴权方式创建的Windows2012弹性云服务器，使用初始密码以MSTSC方式登录时，登录失败，系统显示第一次登录之前，你必须更改密码。请更新密码，或者与系统管理员或技术支持联系
哪些用户有权限使用加密特性	对于一个用户组的用户，加密特性使用权限的规则如下：拥有SecurityAdministrator权限的用户可以直接授权EVS访问KMS，使用加密特性。普通用户即没有SecurityAdministrator权限的用户使用加密特性时，根据该普通用户是否为用户组内第一个使用加密特性的用户，作如下区分：是，即该普通用户是用户组内第一个使用加密特性的，需先联系拥有SecurityAdministrator权限的用户增加权限，然后再使用加密特性。否，即用户组内的其他用户已经使用过加密特性，该普通用户有权限直接使用加密特性。下面，我们以一个用户组为例，介绍授权EVS访问KMS时的用户权限问题。假设该用户组有4个用户用户1用户4，其中，用户1拥有权限，其他三个用户为普通用户，没有权限，如图1所示。图1用户组
堆栈、编排、模板、设计包分别是什么？	详细概念请参照表1表1编排基本概念概念概念说明编排编排是指对组成堆栈的元素按照一定的次序进行处理的过程。通过定义应用组件、对资源的需求、依赖的服务、元素之间的关系拓扑等，完整地描述应用本身以及所依赖的服务、资源，最后交由ServiceStage平台完成部署。设计包运维人员对应用的拓扑、生命周期管理计划进行设计，并输出应用模板也可称为应用设计包设计器还提供了图形化设计器工具，用户可通过拖拽方式完成复杂应用的编排及拓扑设计，可以保存成模板，使用模板创建堆栈，简化应用部署难度，提升效率。模板模板是对堆栈的描述，包括基于应用模型的堆栈拓扑定义、堆栈生命周期描述、运行时资源描述、软件组件描述等。模板通过设计包创建而来，本质与设计包相同。堆栈由应用、服务、资源等元素组成的一个部署实例，平台将相关编排元素通过堆栈进行集中管理。
OBS系统中会不会残留垃圾数据？	系统中会不会残留垃圾数据？显示碎片管理系统中会不会残留垃圾数据？系统中会不会残留垃圾数据？会，OBS采用分块上传的模式上传数据，在下列情况下但不仅限于此通常会导致数据上传失败而产生垃圾数据。网络条件较差，与OBS的服务器之间的连接经常断开。上传过程中，人为中断上传任务。设备故障。突然断电等特殊情况。
调用AIS的API失败时怎么处理？	检查原因根据API调用返回结果或者错误码查找原因。检查访问密钥AK是否获取成功。检查Token是否填写正确或者已过期。检查API调用方法是否正确。
CloudStream支持输出到哪些目标？	支持将作业的结果数据输出到数据接入服务上和关系型数据库
支持哪些接口类型的云专线？	支持千兆电口和万兆光口连接。
开发者Portal对浏览器的要求	消息短信服务的开发者Portal仅支持使用以下浏览器登录：及以上版本浏览器及以上版本浏览器
如何登录软件开发云？	登录软件开发云分为两种情况：注册账号登录和管理员创建的用户登录。两种情况登录方式分别如下：说明：注册账号为注册的企业用户，管理员创建的用户为企业用户下的用户即企业用户自己创建的用户
什么是RDS实例可用性	实例可用性的计算公式：实例可用性故障时间服务总时间
如何使用通信平台云服务？	通信平台云提供了语音、视频、协作等基础资源服务能力，我们提供了丰富的SDK接口，您可以使用我们提供的组件SDK，在您的用户程序中调用SDK的接口访问通信平台云服务。二次开发指导请参见如何基于通信平台云进行二次开发
分布式消息服务是否提供“至少一次”的消息交付功能？	至少一次的消息交付功能？是的。分布式消息服务会在多台服务器上存储消息的副本，以实现冗余和高可用性。在极少数情况下，当您接收或删除消息时，存储消息副本的服务器之一可能不可用。如果出现这种情况，则该不可用服务器上的消息副本将不会被删除，并且您在接收消息时可能会再次获得该消息副本。这被称为至少一次交付。因此，您必须将您的应用程序设计为幂等的应用程序即，如果您的应用程序多次处理同一条消息，则不得受到不利影响
什么是服务？	服务定义了实例以及访问实例的途径，比如单个稳定的IP地址和相应的DNS名称。在创建应用时会指定服务名称。服务的类型有三种，分别是InternalService、NodePort、LoadBalancer。类型的服务只能在集群内部访问。、LoadBalancer类型的服务支持从内部和外部访问。
申请开通裸金属服务器需要多久？	通常在72小时之内开通成功。
我可以在OBS中存储多少数据？	我可以在OBS中存储多少数据？显示一般性问题我可以在OBS中存储多少数据？我可以在OBS中存储多少数据？系统和单个桶都没有总数据容量和对象文件数量的限制。
能否在函数代码中使用线程和进程？	用户可使用编程语言和操作系统的功能，在函数中创建额外的线程和进程。
相关配置是否有相对合理的推荐值?	于健康检查的参数配置，提供如下参考建议。间隔时间：2秒，间隔时间为健康检查每次检查的时间间隔。超时时间：5秒，超时时间为健康检查等待时间。健康阈值：3，健康阈值为健康检查的连续变化次数。不健康阈值：3，不健康阈值为不健康检查的连续变化次数。在此配置下有利于用户服务及应用状态的尽快收敛。云服务器健康检查失败响应时间：2如果用户有更高要求，可以适当地降低响应超时时间值，但必须先保证自己服务在正常状态下的处理时间小于这个值。云服务器健康检查成功响应时间：2
RDS数据库实例支持的最大数据连接数是多少	对此未做限制，取决于数据库引擎参数的默认值和取值范围，例如MySQL引擎的max和max参数，用户可在参数组自定义。
CCE服务常见的使用场景有哪些？	服务常见的使用场景如下：适用于传统IT架构渐进式转型的场景，实现单一架构解耦拆分为多个容器，系统更灵活，轻松应对市场变化。适用于业务上线效率低下的场景，实现容器镜像贯穿从开发到运维各环节，统一环境配置，业务快速上线。适用于访问量有明显波峰、波谷的应用，实现自动弹性伸缩，系统秒级自动弹性扩容，快速响应并发高峰。适用于系统IT资源浪费严重的场景，使平均负载维持较高水平，每分钱都真正支持业务。适用于复杂系统运维压力大的场景，基于容器服务实现自动化运维，基于实时日志快速问题定位，界面化操作和短信通知实现24小时自动监控。
导入成员后页面没有反应怎么办	导入成员后，页面可能无法立即显示导入结果，您可以刷新页面后查看。
如何使用流水线？	流水线提供可视化、可定制的自动交付流水线，帮助企业缩短交付周期，提升交付效率。
共享文档时，文档很长时间才显示出来	共享文档时，会弹出一个正在打印的提示，文档很长时间才显示出来。文档共享是将文档打印后再共享的，打印过程是调用操作系统的打印接口完成，弹出正在打印提示属于正常现象，客户端程序控制不了。如果文件比较大，打印可能耗时较长，导致文档很长时间才显示出来，可搜索如下日志来确定打印用的时间。
连接分布式缓存服务必须使用密码吗？如何获取密码？	本身支持不设置密码，客户端可以直接连接Redis缓存服务并使用。出于安全考虑，客户端连接缓存实例必须通过密码来鉴权验证。您需要在创建缓存实例时自定义密码。分布式缓存服务处于运行中状态的缓存实例支持修改密码，集群实例暂不支持修改密码。
对象存储与SAN存储和NAS存储相比较有什么优势？	对象存储与SAN存储和NAS存储相比较有什么优势？显示一般性问题对象存储与SAN存储和NAS存储相比较有什么优势？对象存储与SAN存储和NAS存储相比较有什么优势？存储提供给应用的是一个LUN或者是一个卷，LUN和卷是面向磁盘空间的一种组织方式，上层应用要通过FC或者ISCSI协议访问SAN。SAN存储处理的是管理磁盘的问题，其它事情都要依靠上层的应用程序实现。存储提供给应用的是一个文件系统或者是一个文件夹，上层应用通过NFS和CIFS协议进行访问。文件系统要维护一个目录树。对象存储更加适合web类应用，基于URL访问地址提供一个海量的桶存储空间，能够存储各种类型的文件对象，对象存储是一个扁平架构，无需维护复杂的文件目录。无需考虑存储空间的限制，一个桶支持近乎无限大的存储空间。
我申请裸金属服务器可以和同VPC内的弹性云服务器通信吗？	可以。您创建的VPC，可能存在多个网段，裸金属服务器和弹性云服务器在同一个网段时进行二层通信，在不同网段时进行三层通信。此外，与弹性云服务器通信时必须配置安全组规则。由于裸金属服务器暂不支持安全组配置，所以只需在与弹性云服务器关联的安全组中配置相应的规则，对裸金属服务器IP进行放通操作。
弹性负载均衡是否可以添加不同操作系统的云服务器？	可以。本身不会限制后端的云服务器使用哪种操作系统，只要您的2台云服务器中的应用服务部署是相同且保证数据的一致性即可。但是，我们建议您选择2台相同操作系统的云服务器进行配置，以便您日后的管理维护。
重装操作系统是否需要收费？	重装操作系统提供以原镜像进行系统重装的功能，不会收取额外费用。
RDS能够保存多长时间的备份	自动快照有效期根据用户设置的备份天数而定。备份空间不占用用户购买的数据库空间。快照没有时间限制，且用户可根据需要进行删除。每个租户手动快照总配额默认为50。
DDS有哪些安全保障措施	可设置所属VPC，从而确保实例与其它业务实现网络安全隔离。另外，通过统一身份认证服务，以下简称IAM，可以实现对资源的访问权限控制。
如何获取会议设备的设备序列号？	会议设备的设备序列号？会议设备的设备序列号是唯一标识设备的字符串，用以保证将License授权给指定设备的关键，又称设备指纹。使用会议设备前，需要在云视频会议管理控制台上创建会议设备，填写会议设备的设备序列号。登录会议设备的Web界面，选择帮助版本，在弹出的版本页面可以查看会议设备的设备序列号。包装盒或会议设备背面贴有的SN条码纸上也可以查询会议设备的设备序列号。
什么是密钥管理服务？	密钥管理服务，即KMS，是一种安全、可靠、简单易用的密钥托管服务，帮助用户集中管理密钥，保护密钥安全。通过使用硬件安全模块HSM保护密钥安全，帮助用户轻松创建和管理密钥，所有的用户密钥都由HSM中的根密钥保护，避免密钥泄露。KMS对密钥的所有操作都会进行访问控制及日志跟踪，提供所有密钥的使用记录，满足审计和合规性要求。
什么是OBS的事件通知？	什么是OBS的事件通知？显示事件什么是OBS的事件通知？什么是OBS的事件通知？您可以通过事件通知发送警报或触发工作流，并通过消息通知服务：SimpleMessageNotification发送通知。
云硬盘规格是什么	云硬盘可满足大容量存储需求。系统盘容量范围为1GB，数据盘容量范围为10GB
如何使用配置管理？	配置管理提供云端代码托管功能，即支持代码仓库创建克隆、一键式下载上传代码等功能。用户可以快速导入代码库，在云端生成一个基础工程；用户通过IDE插件将云端工程代码一键下载到本地进行功能开发，开发完毕后将变更的代码一键上传到云端。
什么是Pipeline?	是由一系列的activities，DataSource互相关联构成，其中activity表示对数据的处理操作，DataSource表示数据来源和存放位置。相关联的activities表示前一个activity执行完毕后，下一个activity才能开始执行。
云解析服务是否计费？	不收费。
为什么用户接收到的邮件中图片无法显示？	部分邮箱为帮助保护您的隐私，默认禁止自动从Internet下载图片，导致邮件中图片无法显示，您需要在您的邮箱中设置允许自动下载图片即可正常显示图片。
为什么有时报关遵从检测的结果会不准确？	报关遵从检测不准确时识别出异常点过多或异常点过少，有以下几个原因：输入数据质量太差。算法默认异常点是小概率出现的，如果输入数据中异常点的比例过高，会造成算法失效。参数设置不合理。参数说明请参见人工智能服务接口参考如果有错误码。错误码具体说明请参见人工智能服务接口参考
删除RDS集群后数据库备份会怎样	和PostgreSQL引擎，根据该集群中是否有可用手动快照来决定：有，保留该集群上现有手动快照，删除集群并释放所有资源。无，跳转到快照管理页面，进行最后一次手动快照创建。引擎，如果集群中有手动快照，保留现有手动快照，其他所有资源被释放。说明：引擎目前不支持恢复到新数据库实例，所以，保留的手动快照暂不可用。
为什么智能装车效果较差？	智能装车效果较差时，有以下几个原因：箱子类型较多。算法考虑的约束条件较多，在箱子类型较多时效果可能不如预期，建议将箱子类型进行筛选。参数设置不合理。算法对参数约束条件较多，需严格按照参数说明输入，具体请参见人工智能服务接口参考
使用HTTP/HTTPS协议有什么注意事项？	协议有什么注意事项？使用HTTP或者HTTPS协议上传文件时，文件的大小不能超过10M。如果超过10M，建议使用TCP协议。
什么是生命周期管理？	什么是生命周期管理？显示生命周期管理什么是生命周期管理？什么是生命周期管理？生命周期管理是指通过配置指定的规则，实现定时删除桶中的对象。
为什么重置密码后新密码没有生效	可能原因密码重置发生在备份操作之后，执行恢复操作时，恢复为旧密码。
一个SSL证书能够绑定几个域名？	目前证书管理服务只提供免费版的DVSSL证书，一个证书只能绑定一个域名。
MRS当前支持哪些组件？	当前支持Hadoop、Spark、HBase和Hive组件，后续会支持更多版本和组件。组件在MRSManager中也被称为服务。
支付成功后为什么不能马上看到创建中的弹性云服务器？	在创建弹性云服务器时，由于系统盘的创建需要少许时间，所以等系统盘创建出来后即可看到创建中的弹性云服务器。
云报表服务是否收费？	公测期间免费。
如何使用Anti	为实例IP地址开启Anti后，即可正常使用。登录管理控制台。选择安全流量清洗，进入Anti服务管理界面。实例列表界面，在待开启防护的实例IP地址所在行，单击开启防护，如图1所示。图1开启防护点击放大
云服务器备份时，需要停止弹性云服务器吗？	不需要，云服务器备份服务支持对正在使用的云服务器进行备份。在云服务器正常运行的情况下，除了将数据写入云硬盘外，还有一部分最新数据保存在内存中作为缓存数据。在做备份时，内存缓存数据不会自动写入云硬盘，会产生数据一致性问题。因此，为了尽量保证备份数据的完整性，最好选择凌晨且云硬盘没有写入数据的时间进行云服务器备份；或者在进行云服务器备份前，暂停所有数据的写操作，且将应用系统停止，再进行备份。如果对备份数据完整性要求极高，则可以将云服务器停机实现缓存数据写入云硬盘，进行离线的云服务器备份。
使用DDS要注意什么	故障切换实例采用多路由多分片复本集的部署形态，当路由主机出现故障时，可实时动态切换。复本集包含多个副本，当主节点发生故障时，会在30秒之内切换到备节点。实例的弹性云服务器，以下简称ECS，对用户都不可见，这意味着，只允许用户应用程序访问数据库对应的IP地址和端口。使用的对象存储服务，以下简称OBS上的备份文件，对用户不可见，它们只对后台管理系统可见。申请后，您还需要做什么：您不需要进行数据库的基础运维比如高可用、安全补丁等，但是您还需要重点关注以下事情：实例的CPU、IOPS、空间是否足够，如果不够需要优化或者扩容。实例是否存在性能问题，是否有大量的慢查询，查询语句是否需要优化，是否有多余的索引或者索引缺失等。
如何使用项目版本计划管理？	项目管理提供迭代功能，可以用来做版本计划管理，用户在项目里新建迭代，匹配版本发布计划时间点，便可对版本计划进行跟踪管理。
服务端问题导致连接失败	服务端可能出现的问题如下，请依次进行检测。连接方式有误。解决方法：检查连接方式。ECS与RDS实例必须处于同一VPC内，且只能通过ECS连接。连接数满。解决方法：通过RDS的资源监控功能查看连接数、CPU使用率等指标是否正常，如果达到上限，需要进行重启RDS实例数据库、断开实例连接或升级RDS实例规格解决。实例状态异常，比如实例重启卡住，RDS系统故障，实例或表被锁定等。解决方法：尝试重启功能。如果无法解决，请联系售后技术支持。
是否支持集群扩容？	服务当前支持扩容，扩容后将增加集群节点以提升计算和存储能力。
事件列表用于记录哪些信息？	事件列表记录了云账户中对云服务资源新建、配置、删除等操作的详细信息。事件列表不记录查询操作的相关信息。
