为什么在VPC中使用DDS	允许您在私有、隔离的网络创建虚拟网络环境，从中可以对私有IP地址范围、子网、路由表和网络网关等方面进行全面控制。借助VPC，您可以定义虚拟网络拓扑和网络配置，使其非常类似于您在自己的数据中心所操作的传统IP网络。在下面的情况下您可能想在VPC中使用您希望运行面向公众的Web应用程序，同时保留公众不可访问的后端服务器。您可以在一个VPC内同时创建一个实例和ECS实例，同时为ECS实例分配公网IP，将Web服务器部署在ECS实例。
如何找回会议用户密码？	会议用户密码？登录会议管理系统单击忘记密码帐号名中填写会议用户帐号，使用注册邮箱的方式找回，单击获取重置链接，如图1所示。系统将会以邮件的形式将重置密码的链接发送至会议用户帐号关联的注册邮箱。图1找回密码
软件开发云中如何对项目成员进行计费？	项目成员数发生变化如何计费项目成员数发生变化如何计费，如表1所示。表1计费规则计费规则示例软件开发云是根据当前系统使用量进行计费的：免费额度以内的项目成员，不计费。新增项目成员，超出免费额度的开始计费，按照单价计算超出部分的使用费用。移除项目成员，停止对被移除成员的计费。
MRS当前支持哪些规格主机？	根据丰富的大数据产品调优经验，提供不同场景对应的最佳搭配。MRS当前支持以下规格主机，主机规格的配型由CPU内存共同决定：云主机：4核内存：16GB：40GB云主机：8核内存：16GB：40GB云主机：16核内存：32GB：40GB云主机：16核内存：64GB：40GB云主机：32核内存：128GB：40GB云主机：16核内存：128GB：1云主机：36核内存：256GB：1核32G服务：8核内存：32GB：40GB主机的实例规格配置越高，数据处理分析能力越强，集群所需费用也越高，请根据您要处理的数据量选择主机配型。
RDS支持读写分离吗	支持读写分离，一个RDS集群中最多可创建5个只读副本。目前不支持Proxy代理，需要在应用侧配置判断和分配读写请求，自行寻址。不支持读写分离。
CloudStream有哪些特点和优势？	的主要特点和优势在于：丰富的StreamSQL在线分析能力支持window、join等聚合函数，用SQL表达业务逻辑，简便快捷实现业务。分布式实时计算支持大规模集群计算，集群弹性伸缩，最大化节省成本。易用在SQL编辑平台写StreamSQL，StreamSQL定义数据流入、数据处理、数据流出，快速便捷实现业务逻辑，降低流数据分析门槛。全托管用户完全不感知计算集群，对运行的作业可视化查看运行状态。开箱即用不再关心各种大数据框架，写StreamSQL，即时运行作业。按需计费定价单位是SPU，用户选定SPU数，按照时长收费，精确到秒。安全隔离租户三重安全机制保障，确保作业安全运行，且租户计算集群完全和其他租户物理隔离，独立的安防设置，确保计算集群的安全性。高吞吐低时延从DIS中读取数据，服务支持自然反压机制，支持高吞吐压力；毫秒级延迟，满足实时计算的业务场景。
什么是DataSource?	表示数据管道操作中被处理的数据，举例来说，一个OBSdatasource表示存放在OBS中的数据，它的path属性，表示了数据的存放路径。
数据仓库服务可以做什么？	数据仓库服务为用户提供一种即开即用、安全可靠的在线数据仓库服务，可以部署任意OLAP数据分析业务，如企业数据仓库，数据集市等。
云专线是否支持续订？怎么续订?	在管理控制台右上角单击用户名称。单击我的订单单击需要续订的订单所在行操作列下的详情进入订单详情页面。单击续订确认续订信息，单击提交如果无续订按钮，请联系技术支持。
如何使用华为云提供的openSUSE镜像源？	操作场景用户需要更新弹性云服务器的系统或者软件时，可以连接Internet，通过外部openSUSE镜像源提供相关服务。但是，如果弹性云服务器无法访问Internet，或者外部openSUSE镜像源提供的服务不稳定时，可以使用华为云提供的openSUSE镜像源进行更新。
每个帐户最多可以创建多少个文件系统？	目前每个帐户可创建最多10个共享文件系统，且支持同时创建，单个文件系统最大使用容量为512000GB。
CentOS6.5系统如何添加静态路由？	操作场景为系统添加静态路由，避免重启系统后路由丢失而影响到网络可用性。
数据超过了DDS实例的最大存储容量怎么办	如果您的应用程序所需的存储容量超过最大分配量，解决措施如下：扩容存储空间。增加shard分片。
我是否需要将磁盘签名文件随磁盘一起邮寄？	是的。创建服务单后，请下载磁盘签名文件放入待邮寄磁盘的根目录，且不要对磁盘签名文件进行加密。
M	公测期间是不收取费用的，您可以免费使用M服务。公测后收取相应费用，费用每小时费率主节点数使用时长每小时费率核心节点数使用时长
主题创建者是否可以控制他们所创建的主题中允许的传输协议？	暂不支持主题传输协议的设置。
什么是服务凭证	服务实例创建之后，如果要访问这个服务实例，都需要知道它的详细信息。这些信息不仅仅是地址和端口，更多的是业务上属性，比如服务实例的账号信息：用户名，密码，key文件等。这类实例的访问信息叫做服务访问凭证。常见的凭证格式有：服务数据库主机名或地址数据库端口号数据库名称数据库用户名数据库密码服务服务
如何自动部署我的应用？	您需要在创建私有镜像前，在源云服务器中安装应用，并设置开机自动启动。弹性伸缩组页签，单击伸缩组名称，在配置名称栏查看该伸缩组使用的伸缩配置详情。确认该伸缩配置选择的镜像是否为中创建的私有镜像。是，结束。弹性伸缩添加的云服务器可以自动部署您的应用了。否，执行创建一个新的伸缩配置，确认该伸缩配置选择的镜像即为中创建的私有镜像。弹性伸缩组页签，单击伸缩组名称，并在配置名称栏单击修改，将该伸缩组的伸缩配置变更为中新创建的伸缩配置。
可用分区之间的数据传输是否需要收费？	同一地域下的可用分区不收费，跨地域的可用分区则需要收费。
切换操作系统是否需要收费？	公有云平台免费为您提供弹性云服务器的切换操作系统功能。切换后，系统将根据您选择的产品重新计费，具体收费请参见产品价格详情
为什么云监控服务中的网络流量指标值与弹性云服务器系统内工具检测的指标不同？	因为云监控服务与弹性云服务器系统内指标检测软件的采样周期不同。云监控服务对弹性云服务器、云硬盘的采样周期是4分钟，而系统内工具的采样周期一般为1秒，远远小于云监控服务的采样周期。采样周期越大，短期内的数据失真越大。所以云监控更适合用于网站长期监测、长期监测运行在弹性云服务器内的应用趋势等。同时，使用云监控服务用户可通过设置阈值对资源进行提前告警，保证资源稳定可靠。
我的数据存储在哪里？	我的数据存储在哪里？显示一般性问题我的数据存储在哪里？我的数据存储在哪里？在OBS上创建桶时，您可以指定一个区域。在该区域内，您的数据存储在多台设备上。
CDN支持哪些业务类型？	不同业务类型的加速配置存在一定差异，当前支持以下方式：网站加速文件下载加速点播加速直播加速内测中，支持线下配置，需要提交工单申请
如何分辨针对性攻击和普通攻击？	可通过安全态势感知里的攻击者态势分析来分辨：攻击者态势界面，单击攻击者ID。查看该攻击者的攻击情况分析，查看攻击本用户和云平台的攻击次数以及目标个数所占比例，如图1所示。图1攻击情况分析点击放大
DIS有哪些模块及各模块功能？	服务控制面完成服务的开通、删除、配置操作，并将用户信息同步到数据面。完成数据面资源的申请与自动部署。服务数据面接收用户发送的请求，对已鉴权的数据接收并存储。接收用户获取数据的请求，在鉴权后输出对应的用户数据。按时老化存储在系统中的用户数据。根据用户配置，将用户数据存储到OBS。服务维护负责服务的安装、升级。负责服务的配置、巡检、日志收集与分析、运行监控。负责服务工单处理。用户SDK提供Java接口，供用户上传与下载数据。提供数据加密功能。
为什么创建队列时提示账号受限？	当租户余额小于100人民币时，无法创建队列，如需继续使用分布式消息服务，请为帐户充值。
我能创建和使用多少个伸缩策略和配置？	您默认可以创建10个弹性伸缩组，100个弹性伸缩配置。每个弹性伸缩组同一时刻支持使用1个伸缩配置，10个伸缩策略。如果系统提供的默认配额不能满足您的需求，请联系管理员进行处理。
为什么安全指数服务显示的概况与实际的配置不同？	如果用户刚进行了安全配置的修改，可以单击各个安全子项概况右上角的，以便后台立即对数据进行刷新及重新进行评估。
弹性伸缩服务是否收取费用？	弹性伸缩服务本身不收取费用。但会按伸缩组内的云服务器实例收取云服务器的费用。
加密镜像如何共享或者发布为市场镜像？	目前，加密镜像不允许共享或者发布为市场镜像，如果用户想要将某个加密的私有镜像共享或者发布为市场镜像，可以通过复制镜像功能，将该镜像复制为一个非加密的新镜像，再共享该非加密镜像共享或者将该非加密镜像发布为市场镜像。
华为云迁移都支持什么场景？	华为业务迁移解决方案主要分为如下场景：传统物理设备到云平台其他公司虚拟化平台到华为云平台华为云平台内部迁移。
数据存储在OBS和HDFS有什么区别？	集群处理的数据源来源于OBS或HDFS，HDFS是Hadoop分布式文件系统，OBS即对象存储服务，是一个基于对象的海量存储服务，为客户提供海量、安全、高可靠、低成本的数据存储能力。MRS可以直接处理OBS中的数据，客户可以基于云管理平台Web界面和OBS客户端对数据进行浏览、管理和使用，同时可以通过RESTAPI接口方式单独或集成到业务程序进行管理和访问数据。数据存储在OBS：数据存储和计算分离，集群存储成本低，存储量不受限制，并且集群可以随时删除，但计算性能取决于OBS访问性能，相对HDFS有所下降，建议在数据计算不频繁场景下使用。数据存储在HDFS：数据存储和计算不分离，集群成本较高，计算性能高，但存储量受磁盘空间限制，删除集群前需将数据导出保存，建议在数据计算频繁场景下使用。
支持哪几种开具发票模式？	系统支持按按到款开具发票按账期开具发票按订单开具发票模式，您可在管理控制台的用户中心自行选择。
服务单状态是“已过期”是什么意思？	已过期是什么意思？当从创建DES服务单开始，如果数据中心管理员在30天内都未接收到磁盘，服务单状态会自动由待寄送磁盘转换为已过期
专属云下购买云服务器与非专属云下购买云服务器有什么不同？	专属云下购买云服务器仅支持按需购买云服务器，不支持包周期购买云服务器。专属云下购买云服务器时，计算资源不计费，使用用户已购买的设备节点剩余的计算资源。如果计算资源不足，则不能继续购买云服务器。
每个主题最多支持多少个订阅者？	每个主题最多支持10000个订阅者。
什么是本地进程？	本地进程，即当前用户弹性云服务器中所有处于运行中的程序。
如何访问云容器引擎？	云容器引擎提供了Web化的服务管理平台，即管理控制台和基于HTTPS请求的API管理方式。方式用户可以通过调用API访问云容器引擎，具体操作请参见云容器引擎接口参考管理控制台方式如果用户已注册云容器引擎，可直接登录管理控制台，从主页选择云容器引擎
密集存储型/高计算型弹性云服务器的网卡无法正常工作，怎么办？	高计算型弹性云服务器的网卡无法正常工作，怎么办？问题描述在使用密集存储型高计算型弹性云服务器时，网卡无法正常工作。
我在什么场景下需要使用跨域资源共享？	我在什么场景下需要使用跨域资源共享？显示跨域资源共享我在什么场景下需要使用跨域资源共享？我在什么场景下需要使用跨域资源共享？使用OBSCORS配置的典型应用场景包括：通过CORS支持，使用JavaScript和HTML5来构建Web应用，直接访问OBS中的资源，而不再需要代理服务器做中转。使用HTML5中的拖拽功能，直接向OBS上传文件，展示上传进度，或是直接从Web应用中更新内容。托管在不同域中的外部网页、样式表和HTML5应用，现在可以引用存储在OBS中的Web字体或图片，让这些资源能被多个网站共享。
ECS无法连接到DDS实例的原因	遇到该问题，请参考以下步骤排查解决。先确认ECS实例和实例是否在同一个VPC。如果在，执行如果不在，需要重新创建ECS实例，使之和实例在同一个VPC下。查看ECS实例是否添加安全组。如果有，检查安全组的配置规则是否满足要求，详见购买数据库实例章节安全组的描述，然后执行如果没有，从ECS的实例详情页面，进入VPC页面，选择安全组，添加安全组。在弹性云服务器ECS上，测试是否可以正常连接到实例地址的端口。mongos的默认端口为8635。实例地址如果可以通信，说明网络是正常的，请检查数据库用户和密码，详见连接数据库实例如果端口不通，请联系售后技术支持协助排查。
事件文件可以存储多长时间？	默认情况下，云审计服务管理控制台可存储最近7天内的事件文件，而对于已保存至OBS桶的历史操作记录，您可以无限期存储这些事件文件。
如何修改Windows弹性云服务器网卡的MTU值？	最大传输单元是指一种通信协议的某一层上所能通过的最大数据报大小，取值范围1280，以字节为单位。以Windows2012为例，介绍Windows弹性云服务器网卡的MTU值的修改方法。开启网卡的JumboPacket。单击开始菜单，打开控制面板图1控制面板点击放大
如何绑定弹性IP？	可以通过申请弹性IP并将弹性IP绑定到弹性云服务器上，实现弹性云服务器访公网的目的。操作步骤登录控制台。在系统首页，选择网络虚拟私有云在左侧导航树，单击弹性IP单击申请弹性IP操作步骤请参考帮助中心虚拟私有云用户指南管理为弹性云服务器申请和绑定弹性IP说明：在绑定IP时，选择一台云服务器，应用即可被外网访问。
为什么要采用mysqldump/pg_dump工具迁移	工具迁移该方案优点是简单，容易上手，缺点是停机时间较长。因此它适用于数据量不大，或者允许停机的时间较长，并且在这个时间范围内能够完成的数据。由于RDS提供的关系数据库服务与原来的数据库服务是完全兼容的，所以对于用户来说，从原有数据库迁移到RDS数据的过程，与从一台数据库服务器迁移到另外一台数据库服务器的过程基本类似。
怎么解决查询运行缓慢的问题	可以通过查看慢查询日志来确定是否存在运行缓慢的查询，以及各个查询的性能特征如果有的话，从而定位查询运行缓慢的原因。查询日志，请参见慢查询日志您还可以查看实例的CPU使用率指标，协助定位问题，请参见使用CES监控
云服务器变更（添加、删除、扩容云硬盘）后能否使用备份恢复数据？	添加、删除、扩容云硬盘后能否使用备份恢复数据？如果您的云服务器做过备份后进行变更，还可以使用原有的备份恢复数据。但因为文件系统的限制，恢复数据后，云硬盘恢复为未变更前的状态，建议您在变更后重新做备份。
为什么查看事件窗口中，有些事件的IP、code、request、response和message字段为空？	、code、request、response和message字段并非必选信息：：当tracetype为SystemAction时，表示本次操作由服务内部触发，此时缺失IP字段为正常情况。：这三个字段是表示本事件所对应的API在调用HTTP请求时发送和接受到的body体和code码，内容由发送事件的云服务决定，缺失为正常情况。：该字段为预留给各云服务自身记录备注信息所用，内容由发送事件的云服务决定，缺失为正常情况。
分布式缓存服务是否支持修改配置参数？	处于运行中状态的缓存实例支持修改配置参数，集群实例暂不支持修改密码。
云报表服务支持哪些MySQL数据类型？	云报表服务支持的MySQL数据类型如表1所示。表1数据类型与云报表服务数据列类型对应关系数据类型云报表数据列类型
通过控制台可以修改哪些参数项（PostgreSQL）	允许通过控制台修改的参数项如下：的可配置参数如表1所示。的可配置参数，在表1的基础上新增表2说明：系统提供的默认参数组不允许修改，只可单击操作列中的查看进行查看。当用户参数设置不合理导致数据库无法启动时，可参考默认参数组重新配置。
Anti	在访问数据流量不超过自动限流触发值的场景下，提供DDoS攻击防护。对于正常业务访问流量超过自动限流触发值的应用，系统会进行自动限流措施正常访问流量会丢失。此场景下，建议用户自主购买第三方清洗中心服务，从第三方获取报表。说明：自动限流触发值由云服务器所在的服务区确定，具体值请查看实例IP的监控报表。
我是否可以对磁盘进行加密后再邮寄？	可以，DES支持使用第三方加密工具Truecrypt对数据进行加密。对磁盘加密后，请务必自行保管好加密密钥，并在启动数据上传时正确输入。如果密钥丢失，则无法解密您的数据。
如何使用部署管理？	部署服务提供可视化、一键式部署服务，支持并行部署和流水线无缝集成，实现部署环境标准化和部署过程自动化。
登录OBS管理控制台访问的OBS资源与登录OBS客户端访问的OBS资源是否相同？	登录OBS管理控制台访问的OBS资源与登录OBS客户端访问的OBS资源是否相同？显示安全性登录OBS管理控制台访问的OBS资源与登录OBS客户端访问的OBS资源是否相同？登录OBS管理控制台访问的OBS资源与登录OBS客户端访问的OBS资源是否相同？相同，用户通过帐户密码登录OBS管理控制台后，可在我的凭证页面创建该帐户对应的AK和SK，若用户使用该AK和SK登录OBS客户端，访问到的OBS资源与通过登录OBS管理控制台访问到的OBS资源相同。
ELB公网IP是否有并发连接数限制？	系统默认的ELB公网IP并发连接数为十万。如果需要更多并发连接数，请提交工单申请扩大并发连接数。提交工单的步骤如下。在管理控制台右上角单击用户名，选择提交工单进入提交工单页面，按照界面提示选择云服务区、业务类型、问题模板，输入问题描述等信息。单击提交
FunctionStage支持哪些编程语言？	目前支持的编程语言有Node、Python、Java。
为什么创建实例时提示帐号受限？	当租户余额小于100人民币时，无法创建实例，如需继续使用分布式缓存服务，请为帐户充值。
主备同步存在多长时间的延迟	主机与备机的同步延迟是无法利用公式来计算的，它会受到以下因素的影响：网络通信状况。主机的事务压力，即主机每秒执行的事务量。主机执行的事务大小，即一个事务要执行多久。备机和只读副本的机器负载状况。如果主机在某个时间段压力非常大，每秒执行的事务量非常多，备机通常会出现延迟。反之，延迟一般都是秒级。对于MySQL，可以在实例管理页面，展开HA集群下备机的详细信息，其中，复制源为该集群下的主机，在复制状态正常的情况下，通过查看复制时延，来获取当前主备同步延迟值。对于PostgreSQL，可以通过CES页面查看监控指标复制时延，来获取当前主备同步延迟值。具体的查看方法，请参见通过CES监控对于MicrosoftSQLServer，目前无法查看。
如何将用户程序提交到MRS中？	为用户提供程序执行平台，程序由用户自身开发，MRS负责程序的提交、执行和监控。那如何将用户程序提交至MRS中呢？新增作业时，将执行程序路径参数配置为用户程序的实际存放路径，如图1所示。图1新增作业点击放大
如何使用TrueCrypt工具对我待邮寄的磁盘进行加密？	您需要先从华为云开发者中心获取与您操作系统相匹配的工具版本，然后安装TrueCrypt并对数据进行加密。具体的工具安装和加密数据方法可参见数据快递服务用户指南
什么是云专线服务？	云专线服务是一个建立连接本地数据中心和云平台的专线网络服务。您可以利用云专线建立云与数据中心、办公室或主机托管区域的专线连接，降低网络时延，获得比Internet线路更好的网络体验。目前云专线仅支持MPLSVPN类型专线。
软件开发云支持哪些开发环境？	软件开发云支持的开发环境类型，如表1所示。说明：软件开发云支持的浏览器类型如下：及以上版本及以上版本及以上版本
